{"type":"FeatureCollection","schema_version":1,"source":{"name":"OpenStreetMap","licence":"ODbL-1.0","licence_url":"https://opendatacommons.org/licenses/odbl/1-0/","attribution":"© OpenStreetMap contributors","attribution_url":"https://www.openstreetmap.org/copyright"},"features":[{"type":"Feature","id":7000000001,"properties":{"feature_type":"street_node"},"geometry":{"type":"Point","coordinates":[103.8507,1.29195]}},{"type":"Feature","id":7000000002,"properties":{"feature_type":"street_node"},"geometry":{"type":"Point","coordinates":[103.8511,1.2923]}},{"type":"Feature","id":7000000003,"properties":{"feature_type":"street_node"},"geometry":{"type":"Point","coordinates":[103.8513,1.2924]}},{"type":"Feature","id":7000000004,"properties":{"feature_type":"street_node"},"geometry":{"type":"Point","coordinates":[103.8519,1.29365]}},{"type":"Feature","id":7000000005,"properties":{"feature_type":"street_node"},"geometry":{"type":"Point","coordinates":[103.8525,1.294]}},{"type":"Feature","id":7000000006,"properties":{"feature_type":"street_node"},"geometry":{"type":"Point","coordinates":[103.8531,1.29425]}},{"type":"Feature","id":7000000007,"properties":{"feature_type":"street_node"},"geometry":{"type":"Point","coordinates":[103.8505,1.2924]}},{"type":"Feature","properties":{"feature_type":"street_edge","osm_way_id":8000000001,"from_osm_node":7000000001,"to_osm_node":7000000002,"highway":"footway","footway":"sidewalk","covered":false,"length_m":58.99},"geometry":{"type":"LineString","coordinates":[[103.8507,1.29195],[103.8511,1.2923]]}},{"type":"Feature","properties":{"feature_type":"street_edge","osm_way_id":8000000001,"from_osm_node":7000000002,"to_osm_node":7000000003,"highway":"footway","footway":"sidewalk","covered":false,"length_m":24.85},"geometry":{"type":"LineString","coordinates":[[103.8511,1.2923],[103.8513,1.2924]]}},{"type":"Feature","properties":{"feature_type":"street_edge","osm_way_id":8000000002,"from_osm_node":7000000003,"to_osm_node":7000000004,"highway":"footway","footway":"crossing","covered":false,"length_m":153.5},"geometry":{"type":"LineString","coordinates":[[103.8513,1.2924],[103.8519,1.29365]]}},{"type":"Feature","properties":{"feature_type":"street_edge","osm_way_id":8000000003,"from_osm_node":7000000004,"to_osm_node":7000000005,"highway":"footway","footway":"sidewalk","covered":true,"length_m":77.18},"geometry":{"type":"LineString","coordinates":[[103.8519,1.29365],[103.8525,1.294]]}},{"type":"Feature","properties":{"feature_type":"street_edge","osm_way_id":8000000003,"from_osm_node":7000000005,"to_osm_node":7000000006,"highway":"footway","footway":"sidewalk","covered":true,"length_m":72.27},"geometry":{"type":"LineString","coordinates":[[103.8525,1.294],[103.8531,1.29425]]}},{"type":"Feature","properties":{"feature_type":"street_edge","osm_way_id":8000000004,"from_osm_node":7000000007,"to_osm_node":7000000001,"highway":"steps","footway":null,"covered":false,"length_m":54.56},"geometry":{"type":"LineString","coordinates":[[103.8505,1.2924],[103.8506,1.2922],[103.8507,1.29195]]}}]}